{
  "schemaVersion": 2,
  "generatedAt": "2026-08-10T16:21:08Z",
  "generatedAtRevision": "sha256:48bcd33805cc5a7e325e975faa4194039c90db0e77562bc54b36cdca40178698",
  "structuralHash": "sha256:de00568789c9c069eb60ba0da4738b56168725b11bde19d0fd31f797dd083dae",
  "generatorVersion": "architecture",
  "analysis": {
    "status": "partial",
    "capabilities": [
      "api-consumers",
      "architecture-findings",
      "gradle-dependencies",
      "gradle-modules",
      "repositories",
      "reverse-usage",
      "screen-ownership"
    ],
    "limitations": [
      "database-schema-not-resolved"
    ],
    "coverage": {
      "schemaVersion": 1,
      "gradleFiles": 86,
      "dependencyExpressions": 0,
      "unsupportedDependencyExpressions": 0,
      "kotlinFiles": 1365,
      "parserErrors": 0,
      "excludedModules": 0,
      "supportedPersistencePatterns": [
        "room-database"
      ],
      "supportedApiPatterns": [
        "kotlin-suspend-class"
      ]
    }
  },
  "summary": {
    "modules": 87,
    "features": 16,
    "screens": 6,
    "dataSources": 22,
    "databaseEntities": null,
    "findingsBySeverity": {
      "error": 0,
      "warning": 79,
      "info": 0
    }
  },
  "nodes": [
    {
      "id": "api:GrippoApi",
      "kind": "api",
      "name": "GrippoApi",
      "path": "data-services/backend/src/commonMain/kotlin/com/grippo/services/backend/GrippoApi.kt",
      "platform": "shared",
      "layer": "infrastructure",
      "metadata": {
        "className": "GrippoApi",
        "methods": [
          "apple",
          "createProfile",
          "deletePushToken",
          "deleteTraining",
          "deleteUser",
          "deleteWeight",
          "getAchievementsByExampleId",
          "getEquipments",
          "getExcludedEquipments",
          "getExcludedMuscles",
          "getExerciseExample",
          "getExerciseExamples",
          "getGoal",
          "getMuscles",
          "getRecentExercisesByExampleId",
          "getTraining",
          "getTrainings",
          "getUser",
          "getWeightHistory",
          "google",
          "login",
          "postExcludedEquipments",
          "postExcludedMuscles",
          "refresh",
          "register",
          "sendPushToken",
          "setGoal",
          "setTraining",
          "updateExperience",
          "updateHeight",
          "updateTraining",
          "updateWeightHistory"
        ]
      }
    },
    {
      "id": "component:h-001b993462fb0c0f09efcd259f7e3639",
      "kind": "component",
      "name": "ProfileCreationComponent",
      "path": "ui-screen-features/authorization/src/commonMain/kotlin/com/grippo/authorization/profile/creation/ProfileCreationComponent.kt",
      "platform": "shared",
      "layer": "ui",
      "metadata": {
        "className": "ProfileCreationComponent"
      }
    },
    {
      "id": "component:h-0a693a1277d2f295ff26f4651c94e0bf",
      "kind": "component",
      "name": "ExperienceComponent",
      "path": "ui-screen-features/authorization/src/commonMain/kotlin/com/grippo/authorization/profile/creation/experience/ExperienceComponent.kt",
      "platform": "shared",
      "layer": "ui",
      "metadata": {
        "className": "ExperienceComponent"
      }
    },
    {
      "id": "component:h-6cdaf2a1b8b287f9cce6d2e72e313ed2",
      "kind": "component",
      "name": "ProfileCompletedComponent",
      "path": "ui-screen-features/authorization/src/commonMain/kotlin/com/grippo/authorization/profile/creation/completed/ProfileCompletedComponent.kt",
      "platform": "shared",
      "layer": "ui",
      "metadata": {
        "className": "ProfileCompletedComponent"
      }
    },
    {
      "id": "component:h-79348c6d1b0378e77ed2cea5b12121a2",
      "kind": "component",
      "name": "ExcludedMusclesComponent",
      "path": "ui-screen-features/authorization/src/commonMain/kotlin/com/grippo/authorization/profile/creation/excluded/muscles/ExcludedMusclesComponent.kt",
      "platform": "shared",
      "layer": "ui",
      "metadata": {
        "className": "ExcludedMusclesComponent"
      }
    },
    {
      "id": "component:h-ff379321ed58b3734a2ae81ca9ccbbf5",
      "kind": "component",
      "name": "MissingEquipmentsComponent",
      "path": "ui-screen-features/authorization/src/commonMain/kotlin/com/grippo/authorization/profile/creation/missing/equipments/MissingEquipmentsComponent.kt",
      "platform": "shared",
      "layer": "ui",
      "metadata": {
        "className": "MissingEquipmentsComponent"
      }
    },
    {
      "id": "component:ui-screen-features/authorization/src/commonMain/kotlin/com/grippo/authorization/AuthComponent.kt~AuthComponent",
      "kind": "component",
      "name": "AuthComponent",
      "path": "ui-screen-features/authorization/src/commonMain/kotlin/com/grippo/authorization/AuthComponent.kt",
      "platform": "shared",
      "layer": "ui",
      "metadata": {
        "className": "AuthComponent"
      }
    },
    {
      "id": "component:ui-screen-features/authorization/src/commonMain/kotlin/com/grippo/authorization/auth/process/AuthProcessComponent.kt~AuthProcessComponent",
      "kind": "component",
      "name": "AuthProcessComponent",
      "path": "ui-screen-features/authorization/src/commonMain/kotlin/com/grippo/authorization/auth/process/AuthProcessComponent.kt",
      "platform": "shared",
      "layer": "ui",
      "metadata": {
        "className": "AuthProcessComponent"
      }
    },
    {
      "id": "component:ui-screen-features/authorization/src/commonMain/kotlin/com/grippo/authorization/login/LoginComponent.kt~LoginComponent",
      "kind": "component",
      "name": "LoginComponent",
      "path": "ui-screen-features/authorization/src/commonMain/kotlin/com/grippo/authorization/login/LoginComponent.kt",
      "platform": "shared",
      "layer": "ui",
      "metadata": {
        "className": "LoginComponent"
      }
    },
    {
      "id": "component:ui-screen-features/authorization/src/commonMain/kotlin/com/grippo/authorization/profile/creation/user/UserComponent.kt~UserComponent",
      "kind": "component",
      "name": "UserComponent",
      "path": "ui-screen-features/authorization/src/commonMain/kotlin/com/grippo/authorization/profile/creation/user/UserComponent.kt",
      "platform": "shared",
      "layer": "ui",
      "metadata": {
        "className": "UserComponent"
      }
    },
    {
      "id": "component:ui-screen-features/authorization/src/commonMain/kotlin/com/grippo/authorization/registration/credential/CredentialComponent.kt~CredentialComponent",
      "kind": "component",
      "name": "CredentialComponent",
      "path": "ui-screen-features/authorization/src/commonMain/kotlin/com/grippo/authorization/registration/credential/CredentialComponent.kt",
      "platform": "shared",
      "layer": "ui",
      "metadata": {
        "className": "CredentialComponent"
      }
    },
    {
      "id": "component:ui-screen-features/authorization/src/commonMain/kotlin/com/grippo/authorization/splash/SplashComponent.kt~SplashComponent",
      "kind": "component",
      "name": "SplashComponent",
      "path": "ui-screen-features/authorization/src/commonMain/kotlin/com/grippo/authorization/splash/SplashComponent.kt",
      "platform": "shared",
      "layer": "ui",
      "metadata": {
        "className": "SplashComponent"
      }
    },
    {
      "id": "component:ui-screen-features/debug/src/commonMain/kotlin/com/grippo/debug/DebugComponent.kt~DebugComponent",
      "kind": "component",
      "name": "DebugComponent",
      "path": "ui-screen-features/debug/src/commonMain/kotlin/com/grippo/debug/DebugComponent.kt",
      "platform": "shared",
      "layer": "ui",
      "metadata": {
        "className": "DebugComponent"
      }
    },
    {
      "id": "component:ui-screen-features/home/src/commonMain/kotlin/com/grippo/home/HomeRootComponent.kt~HomeRootComponent",
      "kind": "component",
      "name": "HomeRootComponent",
      "path": "ui-screen-features/home/src/commonMain/kotlin/com/grippo/home/HomeRootComponent.kt",
      "platform": "shared",
      "layer": "ui",
      "metadata": {
        "className": "HomeRootComponent"
      }
    },
    {
      "id": "component:ui-screen-features/home/src/commonMain/kotlin/com/grippo/home/home/HomeComponent.kt~HomeComponent",
      "kind": "component",
      "name": "HomeComponent",
      "path": "ui-screen-features/home/src/commonMain/kotlin/com/grippo/home/home/HomeComponent.kt",
      "platform": "shared",
      "layer": "ui",
      "metadata": {
        "className": "HomeComponent"
      }
    },
    {
      "id": "component:ui-screen-features/profile/src/commonMain/kotlin/com/grippo/profile/ProfileComponent.kt~ProfileComponent",
      "kind": "component",
      "name": "ProfileComponent",
      "path": "ui-screen-features/profile/src/commonMain/kotlin/com/grippo/profile/ProfileComponent.kt",
      "platform": "shared",
      "layer": "ui",
      "metadata": {
        "className": "ProfileComponent"
      }
    },
    {
      "id": "component:ui-screen-features/profile/src/commonMain/kotlin/com/grippo/profile/body/ProfileBodyComponent.kt~ProfileBodyComponent",
      "kind": "component",
      "name": "ProfileBodyComponent",
      "path": "ui-screen-features/profile/src/commonMain/kotlin/com/grippo/profile/body/ProfileBodyComponent.kt",
      "platform": "shared",
      "layer": "ui",
      "metadata": {
        "className": "ProfileBodyComponent"
      }
    },
    {
      "id": "component:ui-screen-features/profile/src/commonMain/kotlin/com/grippo/profile/equipments/ProfileEquipmentsComponent.kt~ProfileEquipmentsComponent",
      "kind": "component",
      "name": "ProfileEquipmentsComponent",
      "path": "ui-screen-features/profile/src/commonMain/kotlin/com/grippo/profile/equipments/ProfileEquipmentsComponent.kt",
      "platform": "shared",
      "layer": "ui",
      "metadata": {
        "className": "ProfileEquipmentsComponent"
      }
    },